{
  "doi": "10.1007/s11669-008-9366-z",
  "system": "Al-Sc",
  "elements": ["AL", "SC"],
  "phases": [
    {
      "name": "LIQUID",
      "sublattices": [1.0],
      "constituents": [["AL", "SC"]]
    },
    {
      "name": "FCC_A1",
      "sublattices": [1.0],
      "constituents": [["AL", "SC"]]
    },
    {
      "name": "AL3SC",
      "sublattices": [0.75, 0.25],
      "constituents": [["AL"], ["SC"]]
    }
  ],
  "functions": [

    {
      "name": "GSCLIQ",
      "pieces": [
        {
          "T_limits": [298.15, 1608.0],
          "expression": "+14111.4-7.5645*T+GHSERSC#"
        },
        {
          "T_limits": [1608.0, 3000.0],
          "expression": "+18822.2-10.4908*T+GHSERSC#"
        }
      ]
    }
  ],
  "parameters": [

    {
      "type": "G",
      "phase": "LIQUID",
      "constituent_array": [["SC"]],
      "parameter_order": 0,
      "pieces": [
        {
          "T_limits": [298.15, 3000.0],
          "expression": "+GSCLIQ#"
        }
      ]
    },
    {
      "type": "G",
      "phase": "LIQUID",
      "constituent_array": [["AL", "SC"]],
      "parameter_order": 0,
      "pieces": [
        {
          "T_limits": [298.15, 6000.0],
          "expression": "-85000+10.0*T"
        }
      ]
    },
    {
      "type": "G",
      "phase": "LIQUID",
      "constituent_array": [["AL", "SC"]],
      "parameter_order": 1,
      "pieces": [
        {
          "T_limits": [298.15, 6000.0],
          "expression": "-15000"
        }
      ]
    },

    {
      "type": "G",
      "phase": "FCC_A1",
      "constituent_array": [["SC"]],
      "parameter_order": 0,
      "pieces": [
        {
          "T_limits": [298.15, 3000.0],
          "expression": "+GHSERSC#"
        }
      ]
    },
    {
      "type": "G",
      "phase": "FCC_A1",
      "constituent_array": [["AL", "SC"]],
      "parameter_order": 0,
      "pieces": [
        {
          "T_limits": [298.15, 6000.0],
          "expression": "-78000+12.0*T"
        }
      ]
    },
    {
      "type": "G",
      "phase": "FCC_A1",
      "constituent_array": [["AL", "SC"]],
      "parameter_order": 1,
      "pieces": [
        {
          "T_limits": [298.15, 6000.0],
          "expression": "-10000"
        }
      ]
    },
    {
      "type": "G",
      "phase": "AL3SC",
      "constituent_array": [["AL"], ["SC"]],
      "parameter_order": 0,
      "pieces": [
        {
          "T_limits": [298.15, 6000.0],
          "expression": "-43500+5.5*T+0.75*GHSERAL#+0.25*GHSERSC#"
        }
      ]
    }
  ]
}
